{
  "$schema": "https://json-schema.org/draft/2020-12/schema",
  "$id": "https://ricotaarcade.local/schema/mas-o-menos/1",
  "title": "CTR-20 — El banco de Más o menos (US-10)",
  "description": "Solo lo que no existe en otro lado (D-13, D-48 punto 4): los numeros de la banda con su ficha, y las palabras que se cuentan. Los discos, las duraciones, los setlists y en cuantos temas aparece cada palabra se derivan en build y aca no tienen donde escribirse (CTR-20.4).",
  "type": "object",
  "additionalProperties": false,
  "required": ["contrato", "contratoVersion", "actualizado", "datos", "palabras"],
  "properties": {
    "contrato": { "const": "CTR-20" },
    "contratoVersion": { "const": 1 },
    "actualizado": { "type": "string", "pattern": "^\\d{4}-\\d{2}-\\d{2}$" },
    "datos": { "type": "array", "items": { "$ref": "#/$defs/dato" } },
    "palabras": { "type": "array", "items": { "$ref": "#/$defs/palabra" } }
  },
  "$defs": {
    "estado": { "enum": ["listo", "borrador", "retirado"] },
    "notaInterna": {
      "type": "string",
      "minLength": 1,
      "maxLength": 400,
      "comment": "Para el equipo. No viaja al navegador (CTR-20.8)."
    },
    "forma": {
      "type": "string",
      "minLength": 1,
      "maxLength": 24,
      "pattern": "^[a-zñáéíóúü]+$",
      "comment": "Una forma escrita: minuscula, solo letras del castellano, en NFC (una tilde descompuesta no pasa el patron)."
    },
    "dato": {
      "type": "object",
      "additionalProperties": false,
      "required": ["id", "familia", "medida", "pregunta", "valor", "escala", "firmeza", "fuente", "estado"],
      "properties": {
        "id": { "type": "string", "pattern": "^MM-\\d{2,3}$" },
        "familia": {
          "enum": ["la-banda", "la-gente", "los-recitales"],
          "comment": "Las otras cuatro (los-discos, lo-que-dura, en-vivo, las-palabras) se derivan en build y no se escriben a mano (CTR-20.4)."
        },
        "medida": {
          "type": "string",
          "maxLength": 40,
          "pattern": "^(MM-\\d{2,3}|[a-z][a-z0-9]*(-[a-z0-9]+)*)$",
          "not": { "enum": ["anio-disco", "temas-disco", "duracion", "en-vivo", "palabra"] },
          "comment": "MM-NN: medida propia, igual al id, nunca va en par. Un nombre: medida compartida, va en par con los otros datos que la usan. Las cinco de las familias derivadas estan reservadas."
        },
        "pregunta": { "type": "string", "minLength": 10, "maxLength": 140, "pattern": "^¿.+\\?$" },
        "sujeto": { "type": "string", "minLength": 2, "maxLength": 60 },
        "valor": { "type": "integer" },
        "escala": { "enum": ["anio", "entero", "segundos"] },
        "unidad": {
          "type": "array",
          "minItems": 2,
          "maxItems": 2,
          "items": { "type": "string", "minLength": 1, "maxLength": 24, "pattern": "^[a-zñáéíóúü]+( [a-zñáéíóúü]+)*$" },
          "comment": "[singular, plural], por ejemplo [\"año\", \"años\"]."
        },
        "firmeza": {
          "enum": ["hecho", "segun"],
          "comment": "No existe leyenda: una leyenda no puede ser la respuesta de un numero (CLAUDE.md, D-48 punto 6)."
        },
        "segun": { "type": "string", "minLength": 2, "maxLength": 60 },
        "fuente": {
          "type": "string",
          "pattern": "^RES-\\d{2,3}$",
          "not": { "enum": ["RES-20", "RES-90"] },
          "comment": "La ficha del numero. RES-20 y RES-90 las lee el codigo: un numero que esta ahi se deriva, no se copia (D-13)."
        },
        "explicacion": { "type": "string", "minLength": 10, "maxLength": 200 },
        "estado": { "$ref": "#/$defs/estado" },
        "notaInterna": { "$ref": "#/$defs/notaInterna" }
      },
      "allOf": [
        {
          "comment": "Medida propia: sin sujeto. Medida compartida: con sujeto (CTR-20.2).",
          "if": { "properties": { "medida": { "pattern": "^MM-" } } },
          "then": { "not": { "required": ["sujeto"] } },
          "else": { "required": ["sujeto"] }
        },
        {
          "comment": "Un segun lleva el nombre de quien lo dijo y va con medida propia: nunca es la referencia de un par, donde el numero se ve sin su rotulo (CTR-20.2, UX-34 3.2).",
          "if": { "properties": { "firmeza": { "const": "segun" } } },
          "then": { "required": ["segun"], "properties": { "medida": { "pattern": "^MM-" } } },
          "else": { "not": { "required": ["segun"] } }
        },
        {
          "comment": "Un anio no pasa de 2026: un anio futuro es un plan, no un hecho. Sin unidad.",
          "if": { "properties": { "escala": { "const": "anio" } } },
          "then": { "properties": { "valor": { "minimum": 1900, "maximum": 2026 } }, "not": { "required": ["unidad"] } }
        },
        {
          "comment": "Una cantidad arranca en 1 y dice de que es.",
          "if": { "properties": { "escala": { "const": "entero" } } },
          "then": { "properties": { "valor": { "minimum": 1 } }, "required": ["unidad"] }
        },
        {
          "comment": "La escalera de segundos es absoluta y esta hecha para canciones: de 0:30 a 20:00. Lo mas largo va en entero, en minutos.",
          "if": { "properties": { "escala": { "const": "segundos" } } },
          "then": { "properties": { "valor": { "minimum": 30, "maximum": 1200 } }, "not": { "required": ["unidad"] } }
        }
      ]
    },
    "palabra": {
      "type": "object",
      "additionalProperties": false,
      "required": ["id", "palabra", "formas", "estado"],
      "comment": "Sin valor y sin temas: el numero lo cuenta conteo.ts en cada build (CTR-20.3). Que palabra este en formas, que ninguna forma se repita entre palabras y que no queden variantes sin declarar lo prueba el test (CTR-20.11, i9 a i12).",
      "properties": {
        "id": { "type": "string", "pattern": "^MP-\\d{2,3}$" },
        "palabra": { "$ref": "#/$defs/forma" },
        "formas": {
          "type": "array",
          "minItems": 1,
          "maxItems": 8,
          "uniqueItems": true,
          "items": { "$ref": "#/$defs/forma" }
        },
        "noCuentan": {
          "type": "array",
          "minItems": 1,
          "maxItems": 12,
          "items": {
            "type": "object",
            "additionalProperties": false,
            "required": ["forma", "porque"],
            "properties": {
              "forma": { "$ref": "#/$defs/forma" },
              "porque": { "type": "string", "minLength": 8, "maxLength": 200 }
            }
          }
        },
        "estado": { "$ref": "#/$defs/estado" },
        "notaInterna": { "$ref": "#/$defs/notaInterna" }
      }
    }
  }
}
