{
  "contrato": "CTR-20",
  "contratoVersion": 1,
  "actualizado": "2026-09-25",
  "datos": [
    { "id": "MM-01", "familia": "la-banda", "medida": "MM-01", "pregunta": "¿En qué año fue el origen de la banda en La Plata?", "valor": 1976, "escala": "anio", "firmeza": "hecho", "fuente": "RES-05", "estado": "listo" },
    { "id": "MM-02", "familia": "la-banda", "medida": "MM-02", "pregunta": "¿En qué año fue el Lozanazo, el show donde nació el nombre Patricio Rey y sus Redonditos de Ricota?", "valor": 1977, "escala": "anio", "firmeza": "hecho", "fuente": "RES-05", "estado": "listo" },
    { "id": "MM-03", "familia": "la-banda", "medida": "MM-03", "pregunta": "¿En qué año Rocambole tomó la identidad visual completa de la banda?", "valor": 1978, "escala": "anio", "firmeza": "hecho", "fuente": "RES-05", "estado": "listo" },
    { "id": "MM-04", "familia": "la-banda", "medida": "MM-04", "pregunta": "¿En qué año se mudó la banda de La Plata a Buenos Aires?", "valor": 1982, "escala": "anio", "firmeza": "hecho", "fuente": "RES-05", "estado": "listo" },
    { "id": "MM-05", "familia": "la-banda", "medida": "MM-05", "pregunta": "¿En qué año se separó oficialmente la banda?", "valor": 2001, "escala": "anio", "firmeza": "hecho", "fuente": "RES-05", "estado": "listo" },
    { "id": "MM-06", "familia": "la-banda", "medida": "MM-06", "pregunta": "¿Cuántos años pasaron entre el Lozanazo (1977) y la separación oficial de la banda (2001)?", "valor": 24, "escala": "entero", "unidad": ["año", "años"], "firmeza": "hecho", "fuente": "RES-05", "estado": "listo" },
    { "id": "MM-07", "familia": "la-banda", "medida": "MM-07", "pregunta": "¿En qué año la banda ganó el Konex de Platino a mejor banda de rock de la década?", "valor": 2005, "escala": "anio", "firmeza": "hecho", "fuente": "RES-100", "estado": "listo" },
    { "id": "MM-08", "familia": "la-banda", "medida": "MM-08", "pregunta": "¿En qué año se formó La Cofradía de la Flor Solar, la comunidad platense de la que salió Skay?", "valor": 1968, "escala": "anio", "firmeza": "hecho", "fuente": "RES-100", "explicacion": "De ahí salieron Skay y Rocambole, antes de que existiera la banda.", "estado": "listo" },
    { "id": "MM-09", "familia": "la-banda", "medida": "MM-09", "pregunta": "¿Cuántos años pasaron entre la fundación de La Cofradía de la Flor Solar (1968) y el Lozanazo (1977)?", "valor": 9, "escala": "entero", "unidad": ["año", "años"], "firmeza": "hecho", "fuente": "RES-100", "estado": "listo" },
    { "id": "MM-10", "familia": "la-banda", "medida": "MM-10", "pregunta": "¿Cuántos meses estuvo caído el catálogo completo de la banda en las plataformas digitales, entre 2016 y 2017?", "valor": 11, "escala": "entero", "unidad": ["mes", "meses"], "firmeza": "hecho", "fuente": "RES-09", "estado": "listo" },
    { "id": "MM-11", "familia": "la-banda", "medida": "MM-11", "pregunta": "¿En qué año se subió por fin el catálogo completo de la banda a streaming?", "valor": 2017, "escala": "anio", "firmeza": "hecho", "fuente": "RES-09", "explicacion": "Antes había estado once meses caído de las plataformas.", "estado": "listo" },
    { "id": "MM-12", "familia": "la-banda", "medida": "MM-12", "pregunta": "¿En qué año se constituyó Erks S.A., la sociedad dueña del catálogo de la banda?", "valor": 1992, "escala": "anio", "firmeza": "hecho", "fuente": "RES-09", "estado": "listo" },
    { "id": "MM-13", "familia": "la-banda", "medida": "MM-13", "pregunta": "¿Cuántos títulos tiene, en total, la discografía de la banda disponible en streaming?", "valor": 11, "escala": "entero", "unidad": ["título", "títulos"], "firmeza": "hecho", "fuente": "RES-09", "explicacion": "Los diez discos de estudio más el disco en vivo «En directo».", "estado": "listo" },
    { "id": "MM-14", "familia": "la-banda", "medida": "MM-14", "pregunta": "¿Cuántas copias tuvo la primera tirada de Gulp!, hecha a mano una por una?", "valor": 7000, "escala": "entero", "unidad": ["copia", "copias"], "firmeza": "hecho", "fuente": "RES-102", "estado": "listo" },

    { "id": "MM-15", "familia": "la-gente", "medida": "anio-nacimiento", "sujeto": "el Indio Solari", "pregunta": "¿En qué año nació el Indio Solari?", "valor": 1949, "escala": "anio", "firmeza": "hecho", "fuente": "RES-101", "estado": "listo" },
    { "id": "MM-16", "familia": "la-gente", "medida": "anio-nacimiento", "sujeto": "Skay Beilinson", "pregunta": "¿En qué año nació Skay Beilinson?", "valor": 1952, "escala": "anio", "firmeza": "hecho", "fuente": "RES-101", "estado": "listo" },
    { "id": "MM-17", "familia": "la-gente", "medida": "anio-nacimiento", "sujeto": "Semilla Bucciarelli", "pregunta": "¿En qué año nació Semilla Bucciarelli, el bajista?", "valor": 1959, "escala": "anio", "firmeza": "hecho", "fuente": "RES-101", "estado": "listo" },
    { "id": "MM-18", "familia": "la-gente", "medida": "anio-nacimiento", "sujeto": "Sergio Dawi", "pregunta": "¿En qué año nació Sergio Dawi, el saxofonista?", "valor": 1955, "escala": "anio", "firmeza": "hecho", "fuente": "RES-101", "estado": "listo" },
    {
      "id": "MM-19",
      "familia": "la-gente",
      "medida": "anio-nacimiento",
      "sujeto": "Walter Sidotti",
      "pregunta": "¿En qué año nació Walter Sidotti, el baterista?",
      "valor": 1961,
      "escala": "anio",
      "firmeza": "hecho",
      "fuente": "RES-101",
      "estado": "listo",
      "notaInterna": "Único de los seis sin artículo propio de Wikipedia (INV-100, 'Sin resolver', N-037): sale de una efeméride de radio y un posteo cruzados, sin ninguna cifra en disputa. Se carga como hecho con la fuente que hay — D-14, el conocimiento verificado por cruce vale igual."
    },
    { "id": "MM-20", "familia": "la-gente", "medida": "anio-nacimiento", "sujeto": "la Negra Poli", "pregunta": "¿En qué año nació la Negra Poli?", "valor": 1950, "escala": "anio", "firmeza": "hecho", "fuente": "RES-101", "estado": "listo" },
    { "id": "MM-21", "familia": "la-gente", "medida": "edad-lozanazo", "sujeto": "el Indio Solari", "pregunta": "¿Cuántos años tenía el Indio Solari la noche del Lozanazo, en 1977?", "valor": 28, "escala": "entero", "unidad": ["año", "años"], "firmeza": "hecho", "fuente": "RES-101", "estado": "listo" },
    { "id": "MM-22", "familia": "la-gente", "medida": "edad-lozanazo", "sujeto": "Skay Beilinson", "pregunta": "¿Cuántos años tenía Skay Beilinson esa misma noche, la del Lozanazo?", "valor": 25, "escala": "entero", "unidad": ["año", "años"], "firmeza": "hecho", "fuente": "RES-101", "estado": "listo" },
    { "id": "MM-23", "familia": "la-gente", "medida": "MM-23", "pregunta": "¿Cuántos años hay entre el año en que nació el Indio Solari y el año en que nació Skay Beilinson?", "valor": 3, "escala": "entero", "unidad": ["año", "años"], "firmeza": "hecho", "fuente": "RES-101", "estado": "listo" },
    { "id": "MM-24", "familia": "la-gente", "medida": "MM-24", "pregunta": "¿Cuántos integrantes tuvo la formación estable de la banda, entre 1987 y 2001?", "valor": 5, "escala": "entero", "unidad": ["integrante", "integrantes"], "firmeza": "hecho", "fuente": "RES-05", "explicacion": "La que grabó desde «Un baión para el ojo idiota» hasta el final.", "estado": "listo" },
    { "id": "MM-25", "familia": "la-gente", "medida": "MM-25", "pregunta": "¿Cuántos años seguidos tocó esa formación estable sin un solo cambio?", "valor": 14, "escala": "entero", "unidad": ["año", "años"], "firmeza": "hecho", "fuente": "RES-05", "estado": "listo" },
    { "id": "MM-26", "familia": "la-gente", "medida": "MM-26", "pregunta": "¿Cuántos años tenía Willy Crook, el saxofonista invitado, cuando grabó en Gulp!?", "valor": 18, "escala": "entero", "unidad": ["año", "años"], "firmeza": "hecho", "fuente": "RES-102", "estado": "listo" },

    { "id": "MM-27", "familia": "los-recitales", "medida": "anio-show", "sujeto": "Pan Caliente", "pregunta": "¿En qué año tocaron en el festival Pan Caliente?", "valor": 1982, "escala": "anio", "firmeza": "hecho", "fuente": "RES-05", "estado": "listo" },
    { "id": "MM-28", "familia": "los-recitales", "medida": "anio-show", "sujeto": "Cemento con Luca Prodan", "pregunta": "¿En qué año tocaron en Cemento con Luca Prodan?", "valor": 1987, "escala": "anio", "firmeza": "hecho", "fuente": "RES-05", "estado": "listo" },
    { "id": "MM-29", "familia": "los-recitales", "medida": "anio-show", "sujeto": "el show en Montevideo", "pregunta": "¿En qué año dieron su primer show fuera de la Argentina, en Montevideo?", "valor": 1989, "escala": "anio", "firmeza": "hecho", "fuente": "RES-05", "estado": "listo" },
    { "id": "MM-30", "familia": "los-recitales", "medida": "anio-show", "sujeto": "el debut en Obras", "pregunta": "¿En qué año debutaron en el estadio Obras?", "valor": 1989, "escala": "anio", "firmeza": "hecho", "fuente": "RES-05", "estado": "listo" },
    { "id": "MM-31", "familia": "los-recitales", "medida": "anio-show", "sujeto": "el último recital", "pregunta": "¿En qué año fue el último recital de la banda, en el Chateau Carreras de Córdoba?", "valor": 2001, "escala": "anio", "firmeza": "hecho", "fuente": "RES-05", "estado": "listo" },
    { "id": "MM-32", "familia": "los-recitales", "medida": "asistentes-recital", "sujeto": "Huracán, diciembre de 1994", "pregunta": "¿Cuánta gente fue, por noche, a los recitales de Huracán de diciembre de 1994?", "valor": 80000, "escala": "entero", "unidad": ["persona", "personas"], "firmeza": "hecho", "fuente": "RES-05", "estado": "listo" },
    { "id": "MM-33", "familia": "los-recitales", "medida": "asistentes-recital", "sujeto": "Tandil, 1997", "pregunta": "¿Cuánta gente fue al recital de Tandil de 1997?", "valor": 21000, "escala": "entero", "unidad": ["persona", "personas"], "firmeza": "hecho", "fuente": "RES-05", "estado": "listo" },